{
  "schema_version": 1,
  "submission_id": "known-cremer-r6s8-n134",
  "claim": {
    "r": 6,
    "s": 8,
    "n": 134,
    "lower_bound": 135,
    "kind": "known_baseline"
  },
  "certificate": {
    "path": "certificates/cremer-r6s8-n134.txt",
    "sha256": "8ef378ad4d66478c33939e438d3a64572ec2cf7d1647ae29d3568817fedfc982"
  },
  "provenance": {
    "origin": {
      "repository": "https://github.com/fritzcremer/ramsey-lower-bounds",
      "revision": "9382a5eb8e6ec634873cea0850b133764e0eecbf",
      "attribution": "Fritz Cremer, arXiv:2610.12122v1; existing witness independently replayed",
      "license_path": "upstream/cremer/LICENSE"
    },
    "source_manifest": {
      "path": "evidence/source-manifest.json",
      "sha256": "24ea7668dec417a890824c993bda51fa116adc137c05aea8171b6eaab22c1007"
    },
    "seeds": [
      {
        "path": "certificates/cremer-r6s8-n134.txt",
        "sha256": "8ef378ad4d66478c33939e438d3a64572ec2cf7d1647ae29d3568817fedfc982"
      }
    ],
    "run_receipt": {
      "path": "evidence/runs/known-cremer-r6s8-n134.json",
      "sha256": "da7696fcfdd641907d9346c354d731c6aae127ef027a6301139eb7f46cc34002"
    },
    "budget": {
      "wall_seconds": 5,
      "cpu_count": 1
    }
  }
}
